{
  "checker_version": "relational_gain_v0",
  "verdict": "PASS",
  "input": {
    "path": "tests/fixtures/relational_gain_v0/pass.json"
  },
  "metrics": {
    "checked_edges": 3,
    "checked_cycles": 2,
    "max_edge_gain": 0.88,
    "max_cycle_gain": 0.79,
    "warn_threshold": 0.95,
    "offending_edges": [],
    "offending_cycles": [],
    "near_boundary_edges": [],
    "near_boundary_cycles": []
  }
}
