{
  "checker_version": "relational_gain_v0",
  "verdict": "WARN",
  "input": {
    "path": "tests/fixtures/relational_gain_v0/warn.json"
  },
  "metrics": {
    "checked_edges": 3,
    "checked_cycles": 2,
    "max_edge_gain": 0.98,
    "max_cycle_gain": 0.72,
    "warn_threshold": 0.95,
    "offending_edges": [],
    "offending_cycles": [],
    "near_boundary_edges": [
      0.98
    ],
    "near_boundary_cycles": []
  }
}
